{"convention":"natural","excludes":["place"],"items":[{"sha256":"5b101305951942b12e7b2cc516a18b5bf0e0ad01819d7421c041d1ba98f71cf0","text":"npk_kitchen, wide shot from the doorway, morning light"},{"sha256":"1151e5af05b373246b4b2639a7276505885d0a4401691a024ac59f6b5f4814f3","text":"npk_kitchen, medium shot toward the window, morning"},{"sha256":"9909762646b3823ef5e1e8f08d3f699043986775ed47d9c6dcf162987f81365b","text":"npk_kitchen, reverse angle from the window, morning"}],"trigger":"npk_kitchen"}