{"convention":"natural","excludes":["identity"],"items":[{"sha256":"137ce20dc9ef6703486dcca569debc33017bc459f59731708a9606d8433319b3","text":"mira_ex, front view, neutral, red jacket, plain background"},{"sha256":"6c3e7997b8a8adee2df6072833e8d890ca53c53cbba285bb6945f76d9f8416ad","text":"mira_ex, three-quarter view, open smile, red jacket"}],"state":"look-a","trigger":"mira_ex"}